UC1- Create database

mysql> create database addressBook_service;
Query OK, 1 row affected (0.59 sec)
mysql> show databases;
+---------------------+
| Database            |
+---------------------+
| addressbook_service |
| information_schema  |
| mysql               |
| payroll_service     |
| performance_schema  |
| sys                 |
+---------------------+
6 rows in set (0.19 sec)

mysql> use addressBook_service;
Database changed

UC2 :- Create address book table
mysql> create table address_book(
    -> firstName varchar(30) not null,
    -> lastName varchar(30) not null,
    -> address varchar(80) not null,
    -> city varchar(25) not null,
    -> state varchar(25) not null,
    -> zipCode int not null,
    -> phoneNumber varchar(250) not null,
    -> email varchar(20) not null);
Query OK, 0 rows affected (3.44 sec)

mysql> desc address_book;
+-------------+--------------+------+-----+---------+-------+
| Field       | Type         | Null | Key | Default | Extra |
+-------------+--------------+------+-----+---------+-------+
| firstName   | varchar(30)  | NO   |     | NULL    |       |
| lastName    | varchar(30)  | NO   |     | NULL    |       |
| address     | varchar(80)  | NO   |     | NULL    |       |
| city        | varchar(25)  | NO   |     | NULL    |       |
| state       | varchar(25)  | NO   |     | NULL    |       |
| zipCode     | int          | NO   |     | NULL    |       |
| phoneNumber | varchar(250) | NO   |     | NULL    |       |
| email       | varchar(20)  | NO   |     | NULL    |       |
+-------------+--------------+------+-----+---------+-------+
8 rows in set (0.32 sec)

UC3 :- Insert new contacts to address book
mysql> insert into address_book(firstName, lastName, address, city, state, zipCode, phoneNumber, email)values('sheetal', 'adagale', 'shivajinagr', 'pune', 'maharashtra', 411025, 7845215963, 'sheetal@gmail.com');
Query OK, 1 row affected (0.28 sec)

mysql> insert into address_book(firstName, lastName, address, city, state, zipCode, phoneNumber, email)values('preeti', 'nimbadkar', 'kothrud', 'pune', 'maharashtra', 411026, 8675345673, 'preeti11@gmail.com');
Query OK, 1 row affected (0.04 sec)

mysql> insert into address_book(firstName, lastName, address, city, state, zipCode, phoneNumber, email)values('rashmi', 'deshmukh', 'warje', 'pune', 'maharashtra', 411035, 7822725224, 'rash22gmail.com');
Query OK, 1 row affected (0.04 sec)

mysql> select * from address_book;
+-----------+-----------+-------------+------+-------------+---------+-------------+--------------------+
| firstName | lastName  | address     | city | state       | zipCode | phoneNumber | email              |
+-----------+-----------+-------------+------+-------------+---------+-------------+--------------------+
| sheetal   | adagale   | shivajinagr | pune | maharashtra |  411025 | 7845215963  | sheetal@gmail.com  |
| preeti    | nimbadkar | kothrud     | pune | maharashtra |  411026 | 8675345673  | preeti11@gmail.com |
| rashmi    | deshmukh  | warje       | pune | maharashtra |  411035 | 7822725224  | rash22gmail.com    |
+-----------+-----------+-------------+------+-------------+---------+-------------+--------------------+
3 rows in set (0.00 sec)

UC4 :- Edit existing contact person using their name
mysql> update address_book set address = 'pimpri' where firstName = 'rashmi';
Query OK, 1 row affected (0.07 sec)
Rows matched: 1  Changed: 1  Warnings: 0

mysql> select * from address_book;
+-----------+-----------+-------------+------+-------------+---------+-------------+--------------------+
| firstName | lastName  | address     | city | state       | zipCode | phoneNumber | email              |
+-----------+-----------+-------------+------+-------------+---------+-------------+--------------------+
| sheetal   | adagale   | shivajinagr | pune | maharashtra |  411025 | 7845215963  | sheetal@gmail.com  |
| preeti    | nimbadkar | kothrud     | pune | maharashtra |  411026 | 8675345673  | preeti11@gmail.com |
| rashmi    | deshmukh  | pimpri      | pune | maharashtra |  411035 | 7822725224  | rash22gmail.com    |
+-----------+-----------+-------------+------+-------------+---------+-------------+--------------------+
3 rows in set (0.00 sec)

UC5 :- Delete peron using person's name
mysql> delete from address_book where firstName = 'sheetal';
Query OK, 1 row affected (0.07 sec)

mysql> select * from address_book;
+-----------+-----------+---------+------+-------------+---------+-------------+--------------------+
| firstName | lastName  | address | city | state       | zipCode | phoneNumber | email              |
+-----------+-----------+---------+------+-------------+---------+-------------+--------------------+
| preeti    | nimbadkar | kothrud | pune | maharashtra |  411026 | 8675345673  | preeti11@gmail.com |
| rashmi    | deshmukh  | pimpri  | pune | maharashtra |  411035 | 7822725224  | rash22gmail.com    |
+-----------+-----------+---------+------+-------------+---------+-------------+--------------------+
2 rows in set (0.00 sec)